{
 "schema_version": 1,
 "contract_revision": "ih.graph.v1",
 "entities": [
  {
   "key": {
    "organization": "ih-local",
    "identity": {
     "kind": "cluster",
     "cluster_uid": "5f51b1b5-8445-47c0-a9c7-222bb2c92398"
    }
   },
   "lifetime": {
    "from_unix_nano": 0,
    "to_unix_nano": 18446744073709551615
   },
   "attributes": {
    "k8s.cluster.name": {
     "type": "string",
     "value": "5f51b1b5-8445-47c0-a9c7-222bb2c92398"
    },
    "k8s.cluster.uid": {
     "type": "string",
     "value": "5f51b1b5-8445-47c0-a9c7-222bb2c92398"
    },
    "ih.dashboard.profile": {
     "type": "string",
     "value": "orchestrator.kubernetes"
    }
   }
  },
  {
   "key": {
    "organization": "ih-local",
    "identity": {
     "kind": "kubernetes",
     "cluster_uid": "5f51b1b5-8445-47c0-a9c7-222bb2c92398",
     "resource_kind": "namespace",
     "resource_uid": "9a8b7c6d-1111-4222-8333-444455556666"
    }
   },
   "lifetime": {
    "from_unix_nano": 0,
    "to_unix_nano": 18446744073709551615
   },
   "attributes": {
    "k8s.namespace.name": {
     "type": "string",
     "value": "infinite-haiku-p2"
    }
   }
  },
  {
   "key": {
    "organization": "ih-local",
    "identity": {
     "kind": "kubernetes",
     "cluster_uid": "5f51b1b5-8445-47c0-a9c7-222bb2c92398",
     "resource_kind": "node",
     "resource_uid": "4b1d0c7e-0000-4000-8000-000000000000"
    }
   },
   "lifetime": {
    "from_unix_nano": 0,
    "to_unix_nano": 18446744073709551615
   },
   "attributes": {
    "k8s.node.name": {
     "type": "string",
     "value": "pi00"
    },
    "k8s.node.cpu.allocatable": {
     "type": "string",
     "value": "4"
    },
    "k8s.node.memory.allocatable": {
     "type": "string",
     "value": "7997912Ki"
    },
    "k8s.node.arch": {
     "type": "string",
     "value": "arm64"
    },
    "k8s.node.os": {
     "type": "string",
     "value": "linux"
    }
   }
  },
  {
   "key": {
    "organization": "ih-local",
    "identity": {
     "kind": "kubernetes",
     "cluster_uid": "5f51b1b5-8445-47c0-a9c7-222bb2c92398",
     "resource_kind": "node",
     "resource_uid": "4b1d0c7e-0000-4000-8000-000000000001"
    }
   },
   "lifetime": {
    "from_unix_nano": 0,
    "to_unix_nano": 18446744073709551615
   },
   "attributes": {
    "k8s.node.name": {
     "type": "string",
     "value": "pi01"
    },
    "k8s.node.cpu.allocatable": {
     "type": "string",
     "value": "3500m"
    },
    "k8s.node.memory.allocatable": {
     "type": "string",
     "value": "3.5Gi"
    },
    "k8s.node.arch": {
     "type": "string",
     "value": "arm64"
    },
    "k8s.node.os": {
     "type": "string",
     "value": "linux"
    }
   }
  },
  {
   "key": {
    "organization": "ih-local",
    "identity": {
     "kind": "kubernetes",
     "cluster_uid": "5f51b1b5-8445-47c0-a9c7-222bb2c92398",
     "resource_kind": "pod",
     "resource_uid": "a0000000-0000-4000-8000-00000000000a"
    }
   },
   "lifetime": {
    "from_unix_nano": 0,
    "to_unix_nano": 18446744073709551615
   },
   "attributes": {
    "k8s.pod.name": {
     "type": "string",
     "value": "ih-redis-6d9f7c5b8-x2k4q"
    },
    "k8s.pod.ip": {
     "type": "string",
     "value": "10.42.0.17"
    },
    "k8s.pod.phase": {
     "type": "string",
     "value": "Running"
    },
    "k8s.namespace.name": {
     "type": "string",
     "value": "infinite-haiku-p2"
    }
   }
  },
  {
   "key": {
    "organization": "ih-local",
    "identity": {
     "kind": "container",
     "cluster_uid": "5f51b1b5-8445-47c0-a9c7-222bb2c92398",
     "pod_uid": "a0000000-0000-4000-8000-00000000000a",
     "container_name": "redis",
     "container_id": "5f1e2d3c4b5a"
    }
   },
   "lifetime": {
    "from_unix_nano": 0,
    "to_unix_nano": 18446744073709551615
   },
   "attributes": {
    "container.name": {
     "type": "string",
     "value": "redis"
    },
    "container.id": {
     "type": "string",
     "value": "5f1e2d3c4b5a"
    },
    "container.ready": {
     "type": "bool",
     "value": true
    },
    "container.restart_count": {
     "type": "i64",
     "value": 2
    },
    "container.state": {
     "type": "string",
     "value": "running"
    }
   }
  },
  {
   "key": {
    "organization": "ih-local",
    "identity": {
     "kind": "kubernetes",
     "cluster_uid": "5f51b1b5-8445-47c0-a9c7-222bb2c92398",
     "resource_kind": "pod",
     "resource_uid": "b0000000-0000-4000-8000-00000000000b"
    }
   },
   "lifetime": {
    "from_unix_nano": 0,
    "to_unix_nano": 18446744073709551615
   },
   "attributes": {
    "k8s.pod.name": {
     "type": "string",
     "value": "ih-shibuya-7c8d9e-abcde"
    },
    "k8s.pod.ip": {
     "type": "string",
     "value": "10.42.1.20"
    },
    "k8s.pod.phase": {
     "type": "string",
     "value": "Running"
    },
    "k8s.namespace.name": {
     "type": "string",
     "value": "infinite-haiku-p2"
    }
   }
  },
  {
   "key": {
    "organization": "ih-local",
    "identity": {
     "kind": "container",
     "cluster_uid": "5f51b1b5-8445-47c0-a9c7-222bb2c92398",
     "pod_uid": "b0000000-0000-4000-8000-00000000000b",
     "container_name": "shibuya",
     "container_id": "aaaa1111"
    }
   },
   "lifetime": {
    "from_unix_nano": 0,
    "to_unix_nano": 18446744073709551615
   },
   "attributes": {
    "container.name": {
     "type": "string",
     "value": "shibuya"
    },
    "container.id": {
     "type": "string",
     "value": "aaaa1111"
    },
    "container.ready": {
     "type": "bool",
     "value": true
    },
    "container.restart_count": {
     "type": "i64",
     "value": 0
    },
    "container.state": {
     "type": "string",
     "value": "running"
    }
   }
  },
  {
   "key": {
    "organization": "ih-local",
    "identity": {
     "kind": "container",
     "cluster_uid": "5f51b1b5-8445-47c0-a9c7-222bb2c92398",
     "pod_uid": "b0000000-0000-4000-8000-00000000000b",
     "container_name": "sidecar",
     "container_id": "bbbb2222"
    }
   },
   "lifetime": {
    "from_unix_nano": 0,
    "to_unix_nano": 18446744073709551615
   },
   "attributes": {
    "container.name": {
     "type": "string",
     "value": "sidecar"
    },
    "container.id": {
     "type": "string",
     "value": "bbbb2222"
    },
    "container.ready": {
     "type": "bool",
     "value": false
    },
    "container.restart_count": {
     "type": "i64",
     "value": 5
    },
    "container.state": {
     "type": "string",
     "value": "waiting"
    }
   }
  },
  {
   "key": {
    "organization": "ih-local",
    "identity": {
     "kind": "kubernetes",
     "cluster_uid": "5f51b1b5-8445-47c0-a9c7-222bb2c92398",
     "resource_kind": "pod",
     "resource_uid": "c0000000-0000-4000-8000-00000000000c"
    }
   },
   "lifetime": {
    "from_unix_nano": 0,
    "to_unix_nano": 18446744073709551615
   },
   "attributes": {
    "k8s.pod.name": {
     "type": "string",
     "value": "ih-kabuki-5b6c7d-pend1"
    },
    "k8s.pod.ip": {
     "type": "string",
     "value": ""
    },
    "k8s.pod.phase": {
     "type": "string",
     "value": "Pending"
    },
    "k8s.namespace.name": {
     "type": "string",
     "value": "infinite-haiku-p2"
    }
   }
  },
  {
   "key": {
    "organization": "ih-local",
    "identity": {
     "kind": "kubernetes",
     "cluster_uid": "5f51b1b5-8445-47c0-a9c7-222bb2c92398",
     "resource_kind": "pod",
     "resource_uid": "d0000000-0000-4000-8000-00000000000d"
    }
   },
   "lifetime": {
    "from_unix_nano": 0,
    "to_unix_nano": 18446744073709551615
   },
   "attributes": {
    "k8s.pod.name": {
     "type": "string",
     "value": "ih-migrate-job-zz9"
    },
    "k8s.pod.ip": {
     "type": "string",
     "value": "10.42.1.30"
    },
    "k8s.pod.phase": {
     "type": "string",
     "value": "Succeeded"
    },
    "k8s.namespace.name": {
     "type": "string",
     "value": "infinite-haiku-p2"
    }
   }
  },
  {
   "key": {
    "organization": "ih-local",
    "identity": {
     "kind": "container",
     "cluster_uid": "5f51b1b5-8445-47c0-a9c7-222bb2c92398",
     "pod_uid": "d0000000-0000-4000-8000-00000000000d",
     "container_name": "migrate",
     "container_id": "d0000000-0000-4000-8000-00000000000d-migrate"
    }
   },
   "lifetime": {
    "from_unix_nano": 0,
    "to_unix_nano": 18446744073709551615
   },
   "attributes": {
    "container.name": {
     "type": "string",
     "value": "migrate"
    },
    "container.id": {
     "type": "string",
     "value": "d0000000-0000-4000-8000-00000000000d-migrate"
    },
    "container.ready": {
     "type": "bool",
     "value": false
    },
    "container.restart_count": {
     "type": "i64",
     "value": 0
    },
    "container.state": {
     "type": "string",
     "value": "terminated"
    }
   }
  },
  {
   "key": {
    "organization": "ih-local",
    "identity": {
     "kind": "kubernetes",
     "cluster_uid": "5f51b1b5-8445-47c0-a9c7-222bb2c92398",
     "resource_kind": "pod",
     "resource_uid": "e0000000-0000-4000-8000-00000000000e"
    }
   },
   "lifetime": {
    "from_unix_nano": 0,
    "to_unix_nano": 18446744073709551615
   },
   "attributes": {
    "k8s.pod.name": {
     "type": "string",
     "value": "ih-poet-0"
    },
    "k8s.pod.ip": {
     "type": "string",
     "value": "10.42.9.5"
    },
    "k8s.pod.phase": {
     "type": "string",
     "value": "Running"
    },
    "k8s.namespace.name": {
     "type": "string",
     "value": "infinite-haiku-p2"
    }
   }
  },
  {
   "key": {
    "organization": "ih-local",
    "identity": {
     "kind": "container",
     "cluster_uid": "5f51b1b5-8445-47c0-a9c7-222bb2c92398",
     "pod_uid": "e0000000-0000-4000-8000-00000000000e",
     "container_name": "poet",
     "container_id": "cccc3333"
    }
   },
   "lifetime": {
    "from_unix_nano": 0,
    "to_unix_nano": 18446744073709551615
   },
   "attributes": {
    "container.name": {
     "type": "string",
     "value": "poet"
    },
    "container.id": {
     "type": "string",
     "value": "cccc3333"
    },
    "container.ready": {